{
  "attribution": "Data courtesy of nflverse (CC BY 4.0). Unofficial fan-made project; not affiliated with the NFL.",
  "games": [
    {
      "away": "DAL",
      "awayScore": 29,
      "home": "TB",
      "homeScore": 31,
      "id": "2021-REG-1-DAL@TB",
      "season": 2021,
      "type": "REG",
      "week": 1
    },
    {
      "away": "PHI",
      "awayScore": 32,
      "home": "ATL",
      "homeScore": 6,
      "id": "2021-REG-1-PHI@ATL",
      "season": 2021,
      "type": "REG",
      "week": 1
    },
    {
      "away": "PIT",
      "awayScore": 23,
      "home": "BUF",
      "homeScore": 16,
      "id": "2021-REG-1-PIT@BUF",
      "season": 2021,
      "type": "REG",
      "week": 1
    },
    {
      "away": "NYJ",
      "awayScore": 14,
      "home": "CAR",
      "homeScore": 19,
      "id": "2021-REG-1-NYJ@CAR",
      "season": 2021,
      "type": "REG",
      "week": 1
    },
    {
      "away": "MIN",
      "awayScore": 24,
      "home": "CIN",
      "homeScore": 27,
      "id": "2021-REG-1-MIN@CIN",
      "season": 2021,
      "type": "REG",
      "week": 1
    },
    {
      "away": "SF",
      "awayScore": 41,
      "home": "DET",
      "homeScore": 33,
      "id": "2021-REG-1-SF@DET",
      "season": 2021,
      "type": "REG",
      "week": 1
    },
    {
      "away": "JAX",
      "awayScore": 21,
      "home": "HOU",
      "homeScore": 37,
      "id": "2021-REG-1-JAX@HOU",
      "season": 2021,
      "type": "REG",
      "week": 1
    },
    {
      "away": "SEA",
      "awayScore": 28,
      "home": "IND",
      "homeScore": 16,
      "id": "2021-REG-1-SEA@IND",
      "season": 2021,
      "type": "REG",
      "week": 1
    },
    {
      "away": "ARI",
      "awayScore": 38,
      "home": "TEN",
      "homeScore": 13,
      "id": "2021-REG-1-ARI@TEN",
      "season": 2021,
      "type": "REG",
      "week": 1
    },
    {
      "away": "LAC",
      "awayScore": 20,
      "home": "WAS",
      "homeScore": 16,
      "id": "2021-REG-1-LAC@WAS",
      "season": 2021,
      "type": "REG",
      "week": 1
    },
    {
      "away": "CLE",
      "awayScore": 29,
      "home": "KC",
      "homeScore": 33,
      "id": "2021-REG-1-CLE@KC",
      "season": 2021,
      "type": "REG",
      "week": 1
    },
    {
      "away": "MIA",
      "awayScore": 17,
      "home": "NE",
      "homeScore": 16,
      "id": "2021-REG-1-MIA@NE",
      "season": 2021,
      "type": "REG",
      "week": 1
    },
    {
      "away": "GB",
      "awayScore": 3,
      "home": "NO",
      "homeScore": 38,
      "id": "2021-REG-1-GB@NO",
      "season": 2021,
      "type": "REG",
      "week": 1
    },
    {
      "away": "DEN",
      "awayScore": 27,
      "home": "NYG",
      "homeScore": 13,
      "id": "2021-REG-1-DEN@NYG",
      "season": 2021,
      "type": "REG",
      "week": 1
    },
    {
      "away": "CHI",
      "awayScore": 14,
      "home": "LAR",
      "homeScore": 34,
      "id": "2021-REG-1-CHI@LAR",
      "season": 2021,
      "type": "REG",
      "week": 1
    },
    {
      "away": "BAL",
      "awayScore": 27,
      "home": "LV",
      "homeScore": 33,
      "id": "2021-REG-1-BAL@LV",
      "season": 2021,
      "type": "REG",
      "week": 1
    },
    {
      "away": "NYG",
      "awayScore": 29,
      "home": "WAS",
      "homeScore": 30,
      "id": "2021-REG-2-NYG@WAS",
      "season": 2021,
      "type": "REG",
      "week": 2
    },
    {
      "away": "NO",
      "awayScore": 7,
      "home": "CAR",
      "homeScore": 26,
      "id": "2021-REG-2-NO@CAR",
      "season": 2021,
      "type": "REG",
      "week": 2
    },
    {
      "away": "CIN",
      "awayScore": 17,
      "home": "CHI",
      "homeScore": 20,
      "id": "2021-REG-2-CIN@CHI",
      "season": 2021,
      "type": "REG",
      "week": 2
    },
    {
      "away": "HOU",
      "awayScore": 21,
      "home": "CLE",
      "homeScore": 31,
      "id": "2021-REG-2-HOU@CLE",
      "season": 2021,
      "type": "REG",
      "week": 2
    },
    {
      "away": "LAR",
      "awayScore": 27,
      "home": "IND",
      "homeScore": 24,
      "id": "2021-REG-2-LAR@IND",
      "season": 2021,
      "type": "REG",
      "week": 2
    },
    {
      "away": "DEN",
      "awayScore": 23,
      "home": "JAX",
      "homeScore": 13,
      "id": "2021-REG-2-DEN@JAX",
      "season": 2021,
      "type": "REG",
      "week": 2
    },
    {
      "away": "BUF",
      "awayScore": 35,
      "home": "MIA",
      "homeScore": 0,
      "id": "2021-REG-2-BUF@MIA",
      "season": 2021,
      "type": "REG",
      "week": 2
    },
    {
      "away": "NE",
      "awayScore": 25,
      "home": "NYJ",
      "homeScore": 6,
      "id": "2021-REG-2-NE@NYJ",
      "season": 2021,
      "type": "REG",
      "week": 2
    },
    {
      "away": "SF",
      "awayScore": 17,
      "home": "PHI",
      "homeScore": 11,
      "id": "2021-REG-2-SF@PHI",
      "season": 2021,
      "type": "REG",
      "week": 2
    },
    {
      "away": "LV",
      "awayScore": 26,
      "home": "PIT",
      "homeScore": 17,
      "id": "2021-REG-2-LV@PIT",
      "season": 2021,
      "type": "REG",
      "week": 2
    },
    {
      "away": "MIN",
      "awayScore": 33,
      "home": "ARI",
      "homeScore": 34,
      "id": "2021-REG-2-MIN@ARI",
      "season": 2021,
      "type": "REG",
      "week": 2
    },
    {
      "away": "ATL",
      "awayScore": 25,
      "home": "TB",
      "homeScore": 48,
      "id": "2021-REG-2-ATL@TB",
      "season": 2021,
      "type": "REG",
      "week": 2
    },
    {
      "away": "DAL",
      "awayScore": 20,
      "home": "LAC",
      "homeScore": 17,
      "id": "2021-REG-2-DAL@LAC",
      "season": 2021,
      "type": "REG",
      "week": 2
    },
    {
      "away": "TEN",
      "awayScore": 33,
      "home": "SEA",
      "homeScore": 30,
      "id": "2021-REG-2-TEN@SEA",
      "season": 2021,
      "type": "REG",
      "week": 2
    },
    {
      "away": "KC",
      "awayScore": 35,
      "home": "BAL",
      "homeScore": 36,
      "id": "2021-REG-2-KC@BAL",
      "season": 2021,
      "type": "REG",
      "week": 2
    },
    {
      "away": "DET",
      "awayScore": 17,
      "home": "GB",
      "homeScore": 35,
      "id": "2021-REG-2-DET@GB",
      "season": 2021,
      "type": "REG",
      "week": 2
    },
    {
      "away": "CAR",
      "awayScore": 24,
      "home": "HOU",
      "homeScore": 9,
      "id": "2021-REG-3-CAR@HOU",
      "season": 2021,
      "type": "REG",
      "week": 3
    },
    {
      "away": "WAS",
      "awayScore": 21,
      "home": "BUF",
      "homeScore": 43,
      "id": "2021-REG-3-WAS@BUF",
      "season": 2021,
      "type": "REG",
      "week": 3
    },
    {
      "away": "CHI",
      "awayScore": 6,
      "home": "CLE",
      "homeScore": 26,
      "id": "2021-REG-3-CHI@CLE",
      "season": 2021,
      "type": "REG",
      "week": 3
    },
    {
      "away": "BAL",
      "awayScore": 19,
      "home": "DET",
      "homeScore": 17,
      "id": "2021-REG-3-BAL@DET",
      "season": 2021,
      "type": "REG",
      "week": 3
    },
    {
      "away": "ARI",
      "awayScore": 31,
      "home": "JAX",
      "homeScore": 19,
      "id": "2021-REG-3-ARI@JAX",
      "season": 2021,
      "type": "REG",
      "week": 3
    },
    {
      "away": "LAC",
      "awayScore": 30,
      "home": "KC",
      "homeScore": 24,
      "id": "2021-REG-3-LAC@KC",
      "season": 2021,
      "type": "REG",
      "week": 3
    },
    {
      "away": "NO",
      "awayScore": 28,
      "home": "NE",
      "homeScore": 13,
      "id": "2021-REG-3-NO@NE",
      "season": 2021,
      "type": "REG",
      "week": 3
    },
    {
      "away": "ATL",
      "awayScore": 17,
      "home": "NYG",
      "homeScore": 14,
      "id": "2021-REG-3-ATL@NYG",
      "season": 2021,
      "type": "REG",
      "week": 3
    },
    {
      "away": "CIN",
      "awayScore": 24,
      "home": "PIT",
      "homeScore": 10,
      "id": "2021-REG-3-CIN@PIT",
      "season": 2021,
      "type": "REG",
      "week": 3
    },
    {
      "away": "IND",
      "awayScore": 16,
      "home": "TEN",
      "homeScore": 25,
      "id": "2021-REG-3-IND@TEN",
      "season": 2021,
      "type": "REG",
      "week": 3
    },
    {
      "away": "NYJ",
      "awayScore": 0,
      "home": "DEN",
      "homeScore": 26,
      "id": "2021-REG-3-NYJ@DEN",
      "season": 2021,
      "type": "REG",
      "week": 3
    },
    {
      "away": "MIA",
      "awayScore": 28,
      "home": "LV",
      "homeScore": 31,
      "id": "2021-REG-3-MIA@LV",
      "season": 2021,
      "type": "REG",
      "week": 3
    },
    {
      "away": "TB",
      "awayScore": 24,
      "home": "LAR",
      "homeScore": 34,
      "id": "2021-REG-3-TB@LAR",
      "season": 2021,
      "type": "REG",
      "week": 3
    },
    {
      "away": "SEA",
      "awayScore": 17,
      "home": "MIN",
      "homeScore": 30,
      "id": "2021-REG-3-SEA@MIN",
      "season": 2021,
      "type": "REG",
      "week": 3
    },
    {
      "away": "GB",
      "awayScore": 30,
      "home": "SF",
      "homeScore": 28,
      "id": "2021-REG-3-GB@SF",
      "season": 2021,
      "type": "REG",
      "week": 3
    },
    {
      "away": "PHI",
      "awayScore": 21,
      "home": "DAL",
      "homeScore": 41,
      "id": "2021-REG-3-PHI@DAL",
      "season": 2021,
      "type": "REG",
      "week": 3
    },
    {
      "away": "JAX",
      "awayScore": 21,
      "home": "CIN",
      "homeScore": 24,
      "id": "2021-REG-4-JAX@CIN",
      "season": 2021,
      "type": "REG",
      "week": 4
    },
    {
      "away": "WAS",
      "awayScore": 34,
      "home": "ATL",
      "homeScore": 30,
      "id": "2021-REG-4-WAS@ATL",
      "season": 2021,
      "type": "REG",
      "week": 4
    },
    {
      "away": "HOU",
      "awayScore": 0,
      "home": "BUF",
      "homeScore": 40,
      "id": "2021-REG-4-HOU@BUF",
      "season": 2021,
      "type": "REG",
      "week": 4
    },
    {